{
  "candidate_id": "claude_code",
  "agent_id": "general-purpose-1",
  "started_at": "2026-05-19T17:38:20Z",
  "completed_at": "2026-05-19T17:39:05Z",
  "schema_version": "sub-agent-output.v1",
  "dimensions": [
    {"dimension_id": "agentic_planning",  "status": "confirmed", "score": 2.0, "confidence": "high",   "evidence_url": "https://anthropic.com/claude-code"},
    {"dimension_id": "tool_runtime",      "status": "confirmed", "score": 2.0, "confidence": "high",   "evidence_url": "https://docs.anthropic.com/claude-code/tools"},
    {"dimension_id": "multi_agent",       "status": "confirmed", "score": 2.0, "confidence": "high",   "evidence_url": "https://docs.anthropic.com/claude-code/subagents"},
    {"dimension_id": "evidence_fidelity", "status": "partial",   "score": 1.0, "confidence": "medium", "evidence_url": "https://docs.anthropic.com/claude-code/citations"},
    {"dimension_id": "ux_control",        "status": "confirmed", "score": 2.0, "confidence": "high",   "evidence_url": "https://docs.anthropic.com/claude-code/cli"}
  ]
}
